{
  "inputs": {
    "registry/mini-paper-plan.json": "e3bff6e36d2528f63076e0c0c12cfe1c73cf7c64bf290a60e5b5a851afd07672",
    "registry/white-paper-export.json": "209bdda450e6c3706429f050b05f780a41e2de30ab789dfc36ffeef7b52af090"
  },
  "paper": {
    "path": "public/generated-release-artifacts/candidate/mini-papers/executive.md",
    "sha256": "ce7bd414fa7271f53013d25cf9659772d912f9d43667cb607394047e210e8539"
  },
  "profile": {
    "audience": "law-firm leadership and technology governance committees",
    "profile_id": "executive",
    "subtitle": "Protecting professional interaction graphs without alleging unproven provider conduct",
    "title": "The Ajax Line: An Executive Governance Brief"
  },
  "revision": "1.0.0",
  "schema": "claude-legal-audit.mini-paper-sidecar.v1",
  "standard_mappings": {
    "cito": "reviewed internal evidence edges may later map to a controlled citation-intent subset",
    "jats": "unit_id is reserved for future paragraph or section IDs",
    "nanopublication": "reviewed claims may later export as assertion/provenance/publication-info graphs",
    "ro_crate": "a future frozen release may package papers, sidecars, inputs, and build activity",
    "w3c_prov": "paper units are entities generated by this deterministic build activity",
    "w3c_web_annotation": "selector fields use the TextQuoteSelector concept; internal genealogy remains authoritative"
  },
  "status": "blocked_unpublished_candidate",
  "structure_score": {
    "example_optimal_order": [
      "MPU-0007",
      "MPU-0001",
      "MPU-0002",
      "MPU-0003",
      "MPU-0004",
      "MPU-0005",
      "MPU-0006"
    ],
    "maximum_total_basis_points": 10000,
    "mode": "structural_stress_test_not_truth_or_persuasion",
    "optimal_order_count": 60,
    "permutations_evaluated": 5040,
    "planned_is_optimal": true,
    "planned_order": [
      "MPU-0007",
      "MPU-0001",
      "MPU-0002",
      "MPU-0003",
      "MPU-0004",
      "MPU-0005",
      "MPU-0006"
    ],
    "planned_score": {
      "dimensions": {
        "boundary": 1500,
        "falsifiers": 1000,
        "genealogy": 2500,
        "objections": 1500,
        "profile_order": 2500,
        "proof_gaps": 1000
      },
      "maximum_basis_points": 10000,
      "total_basis_points": 10000
    }
  },
  "units": [
    {
      "anchor": "mpu-0007",
      "assertion_ids": [
        "CLM-0003",
        "CLM-0010",
        "CLM-0017",
        "CLM-0018"
      ],
      "does_not_prove": "Impossibility, flawless compliance, zero processing or retention, absence of negotiated differences, or harmlessness.",
      "epistemic_status": "unknown",
      "genealogy": {
        "argument_ids": [
          "FAL-0001",
          "GAP-0002",
          "OBJ-0001",
          "THS-0001"
        ],
        "chunk_ids": [],
        "claim_ids": [
          "CLM-0003",
          "CLM-0010",
          "CLM-0017",
          "CLM-0018"
        ],
        "content_hashes": [
          "386dd211007587aa05ce59bb6869690c8c74976df8161d9fe57ad5d31e1de02e",
          "573e1018aec92cc04fc1c60bce27959e8efeddb9d15ce76992fbadb31885b282",
          "dccc8d857d3b5fc5f7e119bca400ce27c72319bfa93d5e4c6901eb3527d16eb4"
        ],
        "graph_edge_ids": [
          "gedge:sha256:5a6d3bfc4738bb8734918bce33ddfacec8db6f70dcc7e69ebd87822dd3191909",
          "gedge:sha256:6370643f4c57f18966cd3d74e750fa225eb6049c01b7fbc5905eb1db32d1cf0b",
          "gedge:sha256:99f12e0cd960d83dee4d99f563ebe45c421a524dbfbbf407493bd853fadfbba2",
          "gedge:sha256:ac4a6dc53314247fd7a7311169e80044c35c31a16bf28459ea5bb356e46afe4b"
        ],
        "graph_path_ids": [
          "TEP-0011",
          "TEP-0012"
        ],
        "locators": [
          {
            "evidence_grade": "reproducible",
            "locator": "Captured HTML Sections A.2, B, and E; content_sha256:573e1018aec92cc04fc1c60bce27959e8efeddb9d15ce76992fbadb31885b282; retrieved 2026-07-15T13:29:28Z",
            "locator_kind": "captured_selector",
            "source_id": "SRC-0005"
          },
          {
            "evidence_grade": "locator_only",
            "locator": "Pinned repository-wide source-to-sink review at commit 5ceb305b30b4c82653c9b6642499c12e946ec319",
            "locator_kind": "repository_scope",
            "source_id": "SRC-0002"
          },
          {
            "evidence_grade": "reproducible",
            "locator": "Captured HTML Sections B and E; content_sha256:573e1018aec92cc04fc1c60bce27959e8efeddb9d15ce76992fbadb31885b282; retrieved 2026-07-15T13:29:28Z",
            "locator_kind": "captured_selector",
            "source_id": "SRC-0005"
          },
          {
            "evidence_grade": "locator_only",
            "locator": "Pinned repository static design boundary",
            "locator_kind": "repository_scope",
            "source_id": "SRC-0002"
          },
          {
            "evidence_grade": "reproducible",
            "locator": "Documented feature-dependent retention/ZDR policy boundary only; content_sha256:386dd211007587aa05ce59bb6869690c8c74976df8161d9fe57ad5d31e1de02e; not a tenant observation",
            "locator_kind": "captured_selector",
            "source_id": "SRC-0009"
          },
          {
            "evidence_grade": "reproducible",
            "locator": "Documented DPA processing/agreement boundary only; content_sha256:dccc8d857d3b5fc5f7e119bca400ce27c72319bfa93d5e4c6901eb3527d16eb4; Sections B, F, H, Schedule 2; not a tenant observation",
            "locator_kind": "captured_selector",
            "source_id": "SRC-0006"
          }
        ],
        "source_ids": [
          "SRC-0002",
          "SRC-0005",
          "SRC-0006",
          "SRC-0009"
        ],
        "thesis_node_ids": [
          "TMN-0007"
        ]
      },
      "genealogy_sha256": "639baa3ef7d5d847b547f389aaaea82b51b7910bf895178def4f10a2d787a80f",
      "order": 1,
      "profile_id": "executive",
      "render_id": "MPR-executive-0007",
      "render_sha256": "2f5a57e74a5af11738f8adbcffcad57e5e9c186831c54734a85243d47dce1eab",
      "section_id": "MPS-0101",
      "selector": {
        "exact": "The present evidence boundary is decisive: nothing registered in this project establishes covert pooling of identifiable firm ontologies or default training on ordinary commercial content. Standard contractual language and repository safeguards weigh against the strongest hostile interpretation, although they do not prove flawless compliance, zero retention, or identical negotiated terms. Any future allegation should require authenticated contract, runtime, telemetry, or source-to-sink evidence. Until then, the appropriate output is a control program and research agenda, not a verdict about a named provider.",
        "prefix": "Decision boundary",
        "suffix": "Impossibility, flawless compliance, zero processing or retention, absence of negotiated differences, or harmlessness.",
        "type": "TextQuoteSelector"
      },
      "semantic_role": "boundary",
      "tags": [
        "tag:audience:executive",
        "tag:epistemic:unknown",
        "tag:evidence:counterevidence",
        "tag:role:boundary",
        "tag:subject:provider-reuse"
      ],
      "unit_id": "MPU-0007"
    },
    {
      "anchor": "mpu-0001",
      "assertion_ids": [
        "CLM-0014"
      ],
      "does_not_prove": "Ownership, legal protectability, uniqueness, portability, technical learnability, or economic value.",
      "epistemic_status": "mixed",
      "genealogy": {
        "argument_ids": [
          "ARG-0001",
          "FAL-0002",
          "GAP-0001",
          "OBJ-0003",
          "THS-0001"
        ],
        "chunk_ids": [],
        "claim_ids": [
          "CLM-0014"
        ],
        "content_hashes": [],
        "graph_edge_ids": [
          "gedge:sha256:62269be3c85a224a77b279b052cf85764b91d8f881ce28a33cc644ef70ec06fd",
          "gedge:sha256:712d8e6442d2b1ed81e27a883b6e147587c4ce3834f5a3525d0c140ff986fba3",
          "gedge:sha256:c147a7e6b556f36962981cfc7b6d7bf8d7c8caa6f0cebb7d08e8eefb4c5b7734",
          "gedge:sha256:f7ba444222219d6b5f712163f50986e0390eea29204fd2073e300e233f14abc4"
        ],
        "graph_path_ids": [
          "TEP-0001",
          "TEP-0002"
        ],
        "locators": [
          {
            "evidence_grade": "locator_only",
            "locator": "OBHDP Vol. 82 Issue 1 pp. 150-169; DOI 10.1006/obhd.2000.2893; abstract and interaction-network knowledge-transfer framework",
            "locator_kind": "page_span",
            "source_id": "SRC-0047"
          },
          {
            "evidence_grade": "locator_only",
            "locator": "JIT Vol. 15 Issue 1 pp. 69-78; DOI 10.1177/026839620001500106; abstract and two-phase law-firm study",
            "locator_kind": "page_span",
            "source_id": "SRC-0048"
          }
        ],
        "source_ids": [
          "SRC-0047",
          "SRC-0048"
        ],
        "thesis_node_ids": [
          "TMN-0001"
        ]
      },
      "genealogy_sha256": "d38b76f2e114e9ec95bdf28858fbcafd84dd5b9fec33bab6583cffe29c4e213f",
      "order": 2,
      "profile_id": "executive",
      "render_id": "MPR-executive-0001",
      "render_sha256": "64081eb14007a35adbf6a5dacfb0d5c7e90e32d86acc2262874dbc6184752b40",
      "section_id": "MPS-0101",
      "selector": {
        "exact": "A law firm's differentiating asset is not limited to documents or precedent. Value can also reside in recurring relationships among context, choices, rationales, approvals, and outcomes. Those relationships form a professional interaction graph: a practical map of how the institution recognizes risk and exercises judgment. The registered evidence supports treating this as a plausible organizational asset, but it does not establish ownership, legal protectability, uniqueness, portability, technical learnability, or a specific economic value.",
        "prefix": "Decision boundary",